{"extraction_path":"spec/ATS-1/1.0.0-draft.1","imported_at":"2026-08-03T00:00:00Z","manifest_file_count":32,"manifest_sha256":"69ba00101e973aa8a0498851b433aa6eb720ed196112bf925944ed51c7388296","manifest_verification":{"excluded_from_manifest":[],"files_checked":32,"mismatches":[],"missing":[],"status":"match","unlisted":[]},"notes":["The imported package is immutable. Implementation commands read it and never write into it, and this repository adds no file inside the version directory.","This receipt lives in the sibling `receipts/` directory rather than inside the package. The upstream validator asserts that the files under the package root equal the manifest's file list exactly, so a receipt written inside would make the package's own validator fail on every run after the import.","The portable revalidation requested on 2026-08-07 ran at 2026-08-08T05:19:04Z against these immutable imported bytes; this is a new validator event, not a relabelled result from an earlier invocation.","The portable rerun from the repository root was `PATH=.venv/bin:$PATH python spec/ATS-1/1.0.0-draft.1/tools/validate_package.py`; its command, interpreter, timestamp, exit code, status, and output are recorded together. The source archive hash 8ccef3... and MANIFEST hash 69ba00... independently matched; the archive is external provenance, not a redistribution grant."],"package_validator":{"command":["python","spec/ATS-1/1.0.0-draft.1/tools/validate_package.py"],"exit_code":0,"stdout":"ATS-1 package valid: 14 schemas, 30 rules, 13 examples\n","stderr":"","status":"PASS","interpreter":"python","recorded_at":"2026-08-08T05:19:04Z"},"revalidation_requested_at":"2026-08-07T00:00:00Z","schema_version":"ats.import_receipt.v1","source_archive":{"bytes":84299,"expected_sha256":"8ccef3dffdf39ad8f6a2a27f5ed2940c0c6180c57eee0f085a8b4644e7d37c28","filename":"ATS-1_1.0.0-draft.1.zip","root_prefix":"ats1_spec_package","sha256":"8ccef3dffdf39ad8f6a2a27f5ed2940c0c6180c57eee0f085a8b4644e7d37c28","sha256_matches":true},"spec_version":"1.0.0-draft.1","standard":"ATS-1"}
